{"_id":"er1","tenantId":"toc","question":"What is the deadline for the SAT?","counsellor":{"name":"Asha","org":"Acme Counselling"},"aiAnswer":{"text":"The SAT deadline is...","sources":["src1"]},"counsellorAnswer":{"text":"I told them the deadline is..."},"score":{"ai":4,"counsellor":3,"notes":"AI cited a source, counsellor didn't"},"credibility":"internal","createdAt":"2026-09-03T12:00:00Z"}
